[
  {
    "id": "globocan-2022",
    "status": "verified",
    "checkedOn": "2026-10-11",
    "sources": [
      "bray-2024"
    ],
    "text": "GLOBOCAN estimates close to 20 million new cancer cases and 9.7 million cancer deaths worldwide in 2022 (including non-melanoma skin cancers)."
  },
  {
    "id": "globocan-lifetime",
    "status": "verified",
    "checkedOn": "2026-10-11",
    "sources": [
      "bray-2024"
    ],
    "text": "About one in five people develop cancer in their lifetime; around one in nine men and one in twelve women die from it (GLOBOCAN 2022)."
  },
  {
    "id": "globocan-lung",
    "status": "verified",
    "checkedOn": "2026-10-11",
    "sources": [
      "bray-2024"
    ],
    "text": "Lung cancer was the most diagnosed cancer in 2022 (almost 2.5 million cases, 12.4% of the total) and the leading cause of cancer death (an estimated 1.8 million deaths, 18.7%)."
  },
  {
    "id": "globocan-2050",
    "status": "estimate",
    "checkedOn": "2026-10-11",
    "sources": [
      "bray-2024"
    ],
    "text": "Demographic projections suggest the number of new cancer cases will reach about 35 million a year by 2050."
  },
  {
    "id": "alt-medicine-risk",
    "status": "verified",
    "checkedOn": "2026-10-11",
    "sources": [
      "johnson-2018"
    ],
    "text": "In a matched US cohort of patients with curable (non-metastatic) breast, prostate, lung or colorectal cancer, choosing alternative medicine instead of conventional treatment was associated with 2.5 times the risk of death (hazard ratio 2.50, 95% CI 1.88–3.27)."
  },
  {
    "id": "feynman-simulation",
    "status": "verified",
    "checkedOn": "2026-10-11",
    "sources": [
      "feynman-1982"
    ],
    "text": "In a 1982 paper, Richard Feynman argued that efficiently simulating quantum physics would need a computer that itself works by quantum rules."
  },
  {
    "id": "central-dogma",
    "status": "verified",
    "checkedOn": "2026-10-11",
    "sources": [
      "alberts-2017"
    ],
    "text": "Genetic information flows from DNA to RNA (transcription) to protein (translation); a gene's DNA sequence fixes its protein's amino-acid sequence through a code of three-base codons."
  },
  {
    "id": "genome-size",
    "status": "verified",
    "checkedOn": "2026-10-11",
    "sources": [
      "nurk-2022"
    ],
    "text": "The first complete, telomere-to-telomere human genome sequence (T2T-CHM13, 2022) is 3.055 billion base pairs long."
  },
  {
    "id": "cell-count",
    "status": "estimate",
    "checkedOn": "2026-10-11",
    "sources": [
      "sender-2016"
    ],
    "text": "A 70 kg reference adult has about 3.0 × 10¹³ human cells, roughly 90% of them in the blood-forming (haematopoietic) lineage."
  },
  {
    "id": "cell-cycle",
    "status": "verified",
    "checkedOn": "2026-10-11",
    "sources": [
      "alberts-2017"
    ],
    "text": "Cells divide through a regulated cycle (G1, S, G2, M) with checkpoints that can halt division when DNA is damaged or incompletely replicated."
  },
  {
    "id": "mutation-types",
    "status": "verified",
    "checkedOn": "2026-10-11",
    "sources": [
      "alberts-2017",
      "weinberg-2013"
    ],
    "text": "Cancer-relevant DNA changes range from single-base substitutions and small insertions or deletions to copy-number gains and losses, chromosomal rearrangements and gene fusions."
  },
  {
    "id": "ras-switch",
    "status": "verified",
    "checkedOn": "2026-10-11",
    "sources": [
      "ostrem-2013",
      "alberts-2017"
    ],
    "text": "RAS proteins are molecular switches that relay growth signals: active when bound to GTP, inactive when bound to GDP. Oncogenic mutations impair GTP hydrolysis, so more RAS stays switched on."
  },
  {
    "id": "oncogene-tsg",
    "status": "verified",
    "checkedOn": "2026-10-11",
    "sources": [
      "weinberg-2013",
      "knudson-1971"
    ],
    "text": "Oncogenes drive growth when mutated (gain of function; one altered copy usually suffices); tumour-suppressor genes restrain growth and usually must lose both copies (loss of function) before their brake fails. KRAS is a classic oncogene; TP53 and the retinoblastoma gene RB1 are classic tumour suppressors."
  },
  {
    "id": "knudson-two-hit",
    "status": "verified",
    "checkedOn": "2026-10-11",
    "sources": [
      "knudson-1971"
    ],
    "text": "From 48 retinoblastoma cases, Knudson (1971) proposed that the cancer needs two mutational events: in the inherited form one is inherited and the second occurs in a body cell; in the sporadic form both occur in body cells."
  },
  {
    "id": "knudson-poisson",
    "status": "verified",
    "checkedOn": "2026-10-11",
    "sources": [
      "knudson-1971"
    ],
    "text": "Knudson estimated that carriers of the inherited mutation develop on average three retinoblastomas, and used Poisson statistics to explain carriers with no tumour, with tumours in one eye, and with tumours in both eyes."
  },
  {
    "id": "poisson-zero",
    "status": "derived",
    "checkedOn": "2026-10-11",
    "sources": [
      "knudson-1971"
    ],
    "text": "With a Poisson mean of 3 tumours per carrier, the chance that a carrier develops none is e⁻³ ≈ 0.050, about 5%."
  },
  {
    "id": "warburg",
    "status": "verified",
    "checkedOn": "2026-10-11",
    "sources": [
      "warburg-1956",
      "liberti-2016"
    ],
    "text": "Many cancer cells take up large amounts of glucose and ferment it to lactate even when oxygen is available — the Warburg effect."
  },
  {
    "id": "warburg-biomass",
    "status": "verified",
    "checkedOn": "2026-10-11",
    "sources": [
      "vander-heiden-2009"
    ],
    "text": "One explanation of the Warburg effect is that proliferating cells need glucose carbon for biomass (nucleotides, amino acids, lipids), not just for ATP."
  },
  {
    "id": "ras-frequency",
    "status": "verified",
    "checkedOn": "2026-10-11",
    "sources": [
      "prior-2020"
    ],
    "text": "About 19% of patients with cancer harbour RAS mutations — roughly 3.4 million new cases a year worldwide."
  },
  {
    "id": "kras-most-mutated",
    "status": "verified",
    "checkedOn": "2026-10-11",
    "sources": [
      "canon-2019",
      "ostrem-2013"
    ],
    "text": "KRAS is the most frequently mutated oncogene in cancer."
  },
  {
    "id": "bcr-abl-fusion",
    "status": "verified",
    "checkedOn": "2026-10-11",
    "sources": [
      "cohen-2002",
      "druker-2001"
    ],
    "text": "Chronic myeloid leukaemia results from the BCR-ABL fusion gene, whose product is a constitutively active tyrosine kinase."
  },
  {
    "id": "grade",
    "status": "verified",
    "checkedOn": "2026-10-11",
    "sources": [
      "amin-2017"
    ],
    "text": "Pathologists also grade tumours — how abnormal and undifferentiated the cells look under the microscope — and AJCC staging uses grade for some cancers."
  },
  {
    "id": "trial-phases",
    "status": "verified",
    "checkedOn": "2026-10-11",
    "sources": [
      "wong-2019",
      "druker-2001",
      "hodi-2010"
    ],
    "text": "New drugs are tested in phases: phase 1 finds a safe dose (imatinib's first trial escalated doses in 83 patients), phase 2 looks for activity, and phase 3 compares against a control, usually randomised (ipilimumab's trial randomised 676 patients)."
  },
  {
    "id": "endpoints",
    "status": "verified",
    "checkedOn": "2026-10-11",
    "sources": [
      "eisenhauer-2009",
      "hodi-2010"
    ],
    "text": "Common oncology endpoints are overall survival (time to death from any cause), progression-free survival (time to progression, judged by criteria such as RECIST, or death) and objective response rate (the share of patients whose tumours shrink enough to count as a response)."
  },
  {
    "id": "exp-survival",
    "status": "derived",
    "checkedOn": "2026-10-11",
    "sources": [
      "cox-1972"
    ],
    "text": "With a constant hazard λ, survival is S(t) = e^(−λt) and the median survival is ln 2 / λ; a hazard ratio of h multiplies λ by h."
  },
  {
    "id": "multistage",
    "status": "derived",
    "checkedOn": "2026-10-11",
    "sources": [
      "armitage-doll-1954"
    ],
    "text": "Armitage and Doll's multistage theory (1954): if a cell must undergo k rare, independent changes, the chance that all have happened by age t grows roughly as t^k, so cancer incidence rises roughly as t^(k−1) — steeply with age."
  },
  {
    "id": "vqe-shot-bill",
    "status": "derived",
    "checkedOn": "2026-10-11",
    "sources": [
      "montanaro-2015",
      "nielsen-chuang",
      "pyscf-2020"
    ],
    "text": "In this course's VQE lab (H₂, 14 Pauli terms measured separately), reported energies reach chemical accuracy at roughly 10⁴–10⁵ shots per term per estimate — about 10⁸ measurements over a 25-step optimisation.",
    "note": "Computed for this course; grouping commuting terms or better estimators reduce the bill."
  },
  {
    "id": "hallmarks-2000",
    "status": "verified",
    "checkedOn": "2026-10-11",
    "sources": [
      "hanahan-2000",
      "hanahan-2011"
    ],
    "text": "Hanahan and Weinberg (2000) organised cancer into six acquired capabilities: sustaining proliferative signalling, evading growth suppressors, resisting cell death, enabling replicative immortality, inducing angiogenesis, and activating invasion and metastasis."
  },
  {
    "id": "hallmarks-2011",
    "status": "verified",
    "checkedOn": "2026-10-11",
    "sources": [
      "hanahan-2011"
    ],
    "text": "In 2011 they added two emerging hallmarks (reprogramming energy metabolism, evading immune destruction) and two enabling characteristics (genome instability, tumour-promoting inflammation), and stressed the recruited normal cells of the tumour microenvironment."
  },
  {
    "id": "hallmarks-2022",
    "status": "verified",
    "checkedOn": "2026-10-11",
    "sources": [
      "hanahan-2022"
    ],